{
  "$schema": "./default-content.schema.json",
  "version": "1.0.0",
  "description": "Canonical vendor-neutral onboarding and bootstrap package for Iceberg Playbook.",
  "playbooks": [
    {
      "key": "getting-started",
      "name": "Getting Started",
      "code": "GS",
      "description": "Canonical onboarding procedures and baseline operational workflows for the Iceberg Support Playbook system.",
      "icon": "Compass",
      "visibility": "Internal"
    }
  ],
  "sops": [
    {
      "key": "how-to-use-playbooks",
      "playbookKey": "getting-started",
      "title": "How to Use Playbooks",
      "owner": "Support Operations",
      "status": "Verified",
      "estimatedTime": "10 min",
      "purpose": "Explain how to find, open, and navigate Playbooks and their operational content.",
      "whenToUse": "For new users learning how knowledge is organized, or when locating operational content by domain.",
      "requirements": [
        "Active access to the Iceberg Support Playbook portal",
        "Appropriate permission to view the relevant Playbook"
      ],
      "responsibleTeam": "Support Operations & Enablement",
      "checklist": [
        "Locate the correct Playbook",
        "Review Overview",
        "Navigate Issues / Guides / SOPs",
        "Use search/filter where needed",
        "Open the relevant operational content"
      ],
      "steps": [
        {
          "number": 1,
          "title": "Navigate and Find a Playbook",
          "description": "Open the Playbooks directory from the main navigation. Browse the available domain cards or use the search field to filter by name. Each card displays the domain description and live counts for child Issues, Guides, and SOPs.",
          "estimatedTime": "2 min",
          "importantNote": "Playbooks group all operational materials—common issues, solution guides, and standard operating procedures—by functional product or platform domain.",
          "successIndicator": "The target Playbook card is located with its current content counts visible.",
          "videoLink": "assets/getting-started/playbooks/how-to-use-playbooks-tour.mp4"
        },
        {
          "number": 2,
          "title": "Open the Playbook Workspace",
          "description": "Click the target Playbook tile to enter its workspace. The Overview tab immediately surfaces recent operational activity: Recently Updated items, Common Issues, and Issues flagged as Needs Guide.",
          "estimatedTime": "3 min",
          "successIndicator": "The Playbook workspace loads showing the Overview dashboard and active operational sections."
        },
        {
          "number": 3,
          "title": "Navigate Operational Content",
          "description": "Use the Issues, Guides, and SOPs tabs to inspect specific procedures and troubleshooting workflows. Refine lists using the in-playbook search bar or the Verified and Draft status filter. Use the contextual Create action to start a new Issue, Guide, or SOP linked directly to this Playbook.",
          "estimatedTime": "5 min",
          "successIndicator": "Relevant operational content is opened for execution or a linked draft is initiated."
        }
      ],
      "escalationRules": "If the required operational domain or critical procedure is missing, contact the Support Operations Lead with the proposed scope and required subject-matter expertise.",
      "completionCriteria": "The user can locate a Playbook, understand its structure, navigate Issues, Guides, and SOPs, and use search and status filters to find the required content.",
      "relatedIssues": [],
      "relatedGuides": [],
      "internalNotes": "Keep onboarding content aligned with the current Playbooks interface and workflow.",
      "revisionHistory": [
        {
          "version": "1.0.0",
          "date": "2026-10-15",
          "updatedBy": "Support Operations",
          "changes": "Initial canonical onboarding release."
        },
        {
          "version": "1.0.1",
          "date": "2026-10-16",
          "updatedBy": "Support Operations",
          "changes": "Aligned onboarding content with the current Playbooks interface and navigation flow."
        }
      ]
    },
    {
      "key": "how-to-use-issues",
      "playbookKey": "getting-started",
      "title": "How to Use Issues",
      "owner": "Support Operations",
      "status": "Verified",
      "estimatedTime": "10 min",
      "purpose": "Explain how to find, review, and document Issues and access their related solution Guides within a Playbook.",
      "whenToUse": "When investigating a known problem, reviewing symptoms and diagnostic requirements, or documenting a newly identified Issue.",
      "requirements": [
        "Active access to the Iceberg Support Playbook portal",
        "Access to the relevant Playbook",
        "Appropriate Support or Admin permission for create or edit actions"
      ],
      "responsibleTeam": "Tier 1 / Tier 2 Support",
      "checklist": [
        "Locate the relevant Issue",
        "Use search or status filters when needed",
        "Review symptoms and diagnostic information",
        "Open the related Solution Guide if available",
        "Create or update the Issue when appropriate"
      ],
      "steps": [
        {
          "number": 1,
          "title": "Locate and Filter Issues",
          "description": "Open the relevant Playbook and select the Issues tab, or use Quick Access or Global Search to locate an Issue across Playbooks. Use the in-playbook search field and the All, Verified, or Draft status filters to narrow the results. Issue rows show key information such as the Issue code, title, status, difficulty, and Jira Code when available.",
          "estimatedTime": "3 min",
          "successIndicator": "The relevant Issue is identified with its current status and key metadata visible.",
          "videoLink": "assets/getting-started/issues/how-to-use-issues-tour.mp4"
        },
        {
          "number": 2,
          "title": "Review Issue Details and Diagnostics",
          "description": "Open the Issue to review its Problem Summary, Symptoms, Error Message or Code, context, affected area, and Information to Collect. Use these details to understand the problem and the diagnostic information required.",
          "estimatedTime": "3 min",
          "successIndicator": "The Issue symptoms, context, and required diagnostic information have been reviewed."
        },
        {
          "number": 3,
          "title": "Use the Solution Guide or Document New Knowledge",
          "description": "Review the Solution Guide section on the Issue page. If a Guide is available, use Open Guide to access the resolution steps. If the Issue needs a Guide, use Create Guide to begin documenting the solution. If the problem does not yet exist as an Issue, use Create Issue from the Playbook workspace or Create hub.",
          "estimatedTime": "4 min",
          "successIndicator": "The related Guide is opened for execution, or a new Issue or Guide draft is started when needed."
        }
      ],
      "escalationRules": "If an operational problem has no matching Issue, lacks required diagnostic information, or requires urgent escalation, contact the Support Operations Lead with the known symptoms and affected area.",
      "completionCriteria": "The user can locate an Issue, understand its symptoms and diagnostic requirements, access its related Guide, and create or update Issue records when permitted.",
      "relatedIssues": [],
      "relatedGuides": [],
      "internalNotes": "Issues describe diagnosed problems and symptoms. Step-by-step resolutions should be maintained in linked Guides.",
      "revisionHistory": [
        {
          "version": "1.0.0",
          "date": "2026-10-15",
          "updatedBy": "Support Operations",
          "changes": "Initial canonical onboarding release."
        },
        {
          "version": "1.0.1",
          "date": "2026-10-17",
          "updatedBy": "Support Operations",
          "changes": "Aligned onboarding content with the current Issues interface and Guide workflow."
        }
      ]
    },
    {
      "key": "how-to-use-guides",
      "playbookKey": "getting-started",
      "title": "How to Use Guides",
      "owner": "Support Operations",
      "status": "Verified",
      "estimatedTime": "15 min",
      "purpose": "Explain how to locate, follow, verify, and maintain solution Guides linked to diagnosed Issues.",
      "whenToUse": "When following a documented solution, reviewing prerequisites or troubleshooting notes, or creating and updating solution documentation.",
      "requirements": [
        "Active access to the Iceberg Support Playbook portal",
        "Access to the relevant Playbook and Guide",
        "Appropriate Support or Admin permission for create, edit, restore, or delete actions"
      ],
      "responsibleTeam": "Support Engineering & Customer Success",
      "checklist": [
        "Locate the relevant Guide",
        "Confirm the linked Issue and prerequisites",
        "Follow the numbered solution steps",
        "Review Common Problems and supporting media when needed",
        "Check Version History or update the Guide when appropriate"
      ],
      "steps": [
        {
          "number": 1,
          "title": "Locate the Guide and Linked Issue",
          "description": "Open the relevant Playbook and select the Guides tab, use Global Search, or open the Guide directly from an Issue's Solution Guide section. Use search and the All, Verified, or Draft status filters to narrow the results. When the Guide opens, confirm its parent Playbook and linked Issue.",
          "estimatedTime": "3 min",
          "successIndicator": "The correct Guide is open and its linked Issue and current status are confirmed.",
          "videoLink": "assets/getting-started/guides/how-to-use-guides-tour.mp4"
        },
        {
          "number": 2,